,es
0,hello I m back again the last warning to cancel my edit or die
1,I think you spread out and burn a fagot in hell I hate you I m sorry we can not have sex anymore I miss condoms
2,I m also a puppet of socks of this account that really surprises the man who will follow you from the Internet and kill you
3,fuck you smith please let me know when you die I want to dance in your grave
4,It would not be the first time you fucked I ll find out where you live I ll somatize your wife and then I ll burn your house and fuck you damn it
5,Whoever puts a note on my page I ll kill you
6,Shut up thick poop or I ll kick your ass
7,degrade Morton u bastard stop falling my shit you white trash cracker muckraker fuck you fucking racist I hope you die
8,Aaron Swartz stop damn repeat my damn editions I think Aaron Swartz is a stupid ass and he should have died a long time ago I know where you live I ll kill you if he gets back more pages
9,you re a gay homo I hope you re drowning in your penis and you die I m sending a guy with a big cock to jazz on your face
10,Go commit suicide you should be ashamed woofers like you are garbage bags that deserve to die for you Unscientific idiots destroy America 
11,important that you and your family get burned you were warned when you talk to the troll muckrakes page I ll kill you goodbye in the dream
12,Go to die son of the birch
13,What s wrong Kill yourself evil creature
14,Fatherland son of a bitch or I ll kill you
15,Please stop if you continue to ignore our guidelines by inserting incorrect sides into the trachea They are blocked
16,Last warning marker any challenging argument and I will submit you with my ruthless wrath
17,Do not go fuck motherfucker have a life to go fucking bastard and pull your penis through your ass I hate you and I hope you go whenever you fuck I take your mm die die die and all that trash that is for the ass mah marooner I ate I ass ass I ass ass I ass ass I ass ass I ass ass I ass ass I ass ass I ass ass I ass ass I ass ass I ass ass I ass ass I ass ass I ass ass ass I ass ass I butt ass butt ass butt ass butt ass butt ass butt ass butt ass butt ass butt ass me butt ass butt ass butt ass butt ass butt ass butt ass butt ass butt ass butt ass butt ass butt ass butt ass I ass ass I ass ass I ass ass I ass ass I ass ass I ass ass I ass ass I ass ass I ass ass I ass ass I ass ass ass I ass ass ass ass ass ass ass ass ass ass ass ass ass ass ass ass ass ass yo ass ass Yo ass yo ass Yo ass Yo ass Yo ass Yo ass Yo culo Yo Ass Ass Ass Ass Ass I Ass Ass Ass Ass Ass Ass Ass Ass Ass Ass Ass Ass Ass Ass Ass Ass Ass Ass Ass Ass Ass Ass Ass Ass Ass Ass Ass Ass Ass Ass Ass Ass Ass Ass Ass Ass Ass Ass Ass Ass Ass Ass Ass Ass Ass Ass Ass Ass Ass Ass Ass Ass Ass Ass Ass Ass Ass Ass Ass Ass Ass Ass Ass Ass Ass Ass Ass Ass Ass Ass Ass Ass ass ass ass ass ass ass ass ass ass ass ass ass ass ass ass ass ass ass ass ass ass ass ass ass ass ass ass ass ass ass ass ass ass ass ass ass ass ass ass ass ass ass ass ass ass ass ass ass ass ass ass ass ass ass ass ass ass ass ass ass ass ass ass ass ass ass I ate ate ate ate ate ate ate ate ate ate ate ate ate ate ate ate ate ate ate ate ate I ate ate ate as I ass ass ass ass ass ass I ass ass i ass ass i ass ass i ass ass i ass ass i ass ass i ass ass ass i ass ass ass ass ass ass ass ass ass ass ass ass ass ass ass ass ass ass ass ass ass ass ass ass ass ass ass ass Ass Ass Ass Ass Ass ass ass ass ass ass ass ass ass ass ass ass ass ass ass ass ass ass ass ass ass ass ass ass ass ass ass ass ass ass ass ass ass ass ass ass ass ass ass ass I ass i ass I ass I ass I ass I ass I ass I ass I ass I ass I ass I ass I ass I ass I ass I ass I ass I ass I ass I ass ass I ass I ass I ass I ass I ass I ass I ass I ass I ass I ass I ass I ass I ass I ass I ass i ass like me ass ass ass ass ass ass ass ass ass ass ass ass ass ass ass ass ass ass ass ass ass ass ass ass ass ass ass ass ass ass ass ass I ass I ass Yo ass Yo ass Yo ass Yo ass Yo ass Yo ass Yo ass Yo ass Yo ass Yo ass Yo ass Yo ass Yo ass Yo ass Yo ass Yo ass Yo ass yo ass Yo ass Yo ass Yo ass Yo ass Yo ass Yo ass Yo ass Yo ass Yo ass Yo ass Yo ass Yo ass Yo ass Yo ass Yo ass Yo ass Yo ass i ass Yo ass Yo ass Yo ass Yo ass Yo ass I ass I ass I ass I ass I ass I ass I ass I ass I ass I ass I ass ass I ate ate ate I ate ate ate ate ate ate ate ate ate ate ate ate ate ate ate ate ate ate ate myself Ass Ass Ass Ass Ass Ass I Ass Ass Ass Ass Ass Ass Ass Ass Ass Ass Ass Ass Ass ass Ass Ass ass Ass As I ate As I ate As I ate As I ate As I ate As I ate As I ate ate ate ate ate ate ate ate ate ate I ass ate ate ate ate ate ate ate ate ate ate ate ate ate ate ate ate ate ate ate ate ate ate ate ate I ass I ate ate ate ate ate ate ate ate ate ate ate ate I ate I ate I ate I ate I ate I ate I ate I ate I ate omí me como Yo culo yo culo ass ass Yo ass ass Yo ass ass Yo ass ass Yo ass ass I ass ass ass as i ass ass ass ass ass I ass ass ass ass ass ass ass ass ass I ass ass ass me ass ass ass ass ass ass ass ass ass ass ass ass ass ass ass ass ass ass ass ass ass ass ass ass ass ass ass ass Ass ass ass ass ass ass ass butt ass ass butt ass butt ass butt ass
18,Why are you still here Can not you find something more important than killing yourself 
19,sin harassed t I m not obligated to write my post I answer I do not specifically threaten someone and his blows flat it was a derogatory comment when I said I killed him in a fire that another saying go to pray to the church to get cancer or to die in a fire is more a sarcastic tone pity that you can not say that it will take up to 2 weeks just because you can
20,wt why do you erase Seashell bad things will happen to you now
21,How dare you send me such abuse you damned rooster if you dare to warn me Mr Jeff I m going to brutally attack your mother I know where you live 
22,Hula I hope you die 124 180 167 228
23,I do not know anything about Bulgarian shit season but do not be fooled from where I just saw that when I see you redigierst or any other person to dad40x article once I send a meeting with certain people under suspicion of terrorism yes I can do that a terrorism suspect nowadays you can your life young kissing goodbye at the time of sending complaints and you and your naked ass have exiled all the time in the world in the cell block is they think that what went wrong 87252167254
24,Who do you think what the hell are you how dare you my edition in the province of reconverting colloquial brought me a friend to smile and you ruined it by ruining my life and the life of my friends I m your cut the dog in half
25,Wow you re the one who comments that the users that appear on the page slowly drool and try to impose that courtesy you re as miserable as you ve always been and I hope you die in a jazz fire
26,Supertanker0ll will live forever if you do not respect Supertanker0ll will cheat you regrettable Supertanker0ll will live forever if you do not respect Supertanker0ll goes shameful fool Supertanker0ll to live forever if you do not respect Supertanker0ll die you ll be silly pathetic Supertanker0ll live forever if you do not respect the supertanker will die pathetic fool Supertanker0ll will live forever if you do not Supertanker0ll respect the stupid will is unfortunate supertanker0ll live forever if you do not respect the Supertanker0ll you will die miserable fool supertanker0ll live forever if you do not respect the supertanker who will die what a pathetic fool Supertanker0ll will live forever if you do not respect the supertanker who is going to die will live forever Supertanker0ll silly pathetic when you see the Su pertanker you do not respect you will die pathetic fool Supertanker0ll will live forever if you do not respect that anker0ll will die what a pathetic fool supertanker0l The Supert will live forever if you do not respect the supertanker who is going to die what a pathetic fool is supertanker0ll live forever if you have no respect for the supertanker who will die miserable fool Supertanker0ll will live forever if you are not paying the Supertanker0ll that is going to pathetic fool Supertanker0ll will live forever if you do not respect the supertanker that you will die unfortunate fool is Supertanker0ll live forever if you do not respect the supertanker that you are going to die miserable fool Supertanker0ll will live forever if you do respect the supertanker that you will die miserable fool Supertanker0ll will live forever if you do not respect the supertanker you can sterb s It s pathetic fool Supertanker0ll will live forever if you do not respect the supertanker you re going to die miserable fool Supertanker0ll will live forever if you do not Respect the supertanker You will die pathetic supertanker forever if you do not respect Supertanker0ll will cheat you regrettable Supertanker0ll will live forever if you do not respect Supertanker0ll goes shameful fool is supertanker0ll lives forever if you do not respect the Supertanker0ll you are crazy pathetic supertanker0ll live will die forever if the supertanker is not respected after his death as an absolute fool
27,you are a stupid bitch that stupid is your mother has a hairy pussy and I hope and gold you do not die fuck I would like you to die if you had three wishes one of them would have died around you and the others would be so that all your acquaintances hated your pussy as a face
28,Why the hell do you edit my kiwi about the Iranian army you have to die you know the stupid terrorists you live on Israeli soil called Asia Africa which should be free only for Israelis and Muslims 
29,Everyone wants to kill Bill God Dam Gates he s a nerd why not
30,hello mot hello polygamous649 I hope you have a cock that will put your ass I m a 13 year old member of kim and I ll kick your ass so get away and remove my pages bitch
31,I will kill you I will kill you I will kill you I will kill you I will kill you I will kill you I will kill you I will kill you I will kill you I will kill you I will kill you I will kill you I will kill you I will kill you I will kill you I will kill you I will kill you I will kill you I will kill you I will kill you I will kill you I ll kill you I ll kill you I ll kill you I ll kill you I ll kill you I ll kill you I ll kill you I ll kill you I ll kill you I ll kill you I ll kill you I ll kill you I ll kill you I ll kill you I ll kill you I ll kill I ll kill you I ll kill you I ll kill you I ll kill you I ll kill you I ll kill you I ll kill you I ll kill you I ll kill you I ll kill you I ll kill you I ll kill you I ll kill you I ll kill you I ll kill you I ll kill you I ll go to kill I ll kill you I ll kill you I ll kill you I ll kill you I ll kill you I ll kill you I ll do it I ll kill you I ll kill you I ll kill you I ll kill you I ll kill you I ll kill you I ll kill you I ll kill you I ll kill you I ll kill you I ll kill you I ll kill you I ll kill you I ll kill you I d do it I ll kill you I ll kill you I ll kill you I ll kill you I ll kill you I ll kill you I ll kill you I ll kill you I ll kill you I ll kill you I ll kill you I ll kill you I ll kill you I ll kill you I ll kill you I ll kill you I ll kill you I ll kill you I ll kill you I ll kill you I ll kill you I ll kill you I ll kill you I ll kill you I ll kill you I m going to kill you I ll kill you I ll kill you I ll kill you I ll kill you I ll kill you I ll kill you I ll kill you I ll kill you I ll kill you I ll kill you I ll kill you I ll kill you I ll kill you I kill you I ll kill you I ll kill you I ll kill you I ll kill you I ll kill you I ll kill you I ll kill you Ich ge He ll kill you I ll kill you I ll kill you I ll kill you I ll kill you I ll kill you I ll kill you I ll kill you I ll kill you I ll kill you I will kill I will kill you I will kill you I will kill you I will kill you I will kill you I will kill you I will kill you I will kill you I will kill you I will kill you I will kill you I will kill you I will kill you I will kill you I will kill you I will kill you I will kill you I will kill you I will kill you I will kill you I will kill you I will kill you I will kill you I will kill you I will kill you I will kill you I will kill you I will kill you I will kill you I am I kill you I will kill you I will kill you I will kill you I will kill you I will kill you I will kill you I will kill I will not kill you I will kill you I will kill you I will kill you I will kill you I will kill you I will
32,That s it remember the last time you fucked the dildo with me your ear all the blood you gave me there s no choice but to repeat the punishment this time it s going to be 12
33,Fuck you idealistic sarcastic I ll kill you with my gun too bitch ass mother motherfucker
34,who cares about shit Anthony ordainer is a tool I just wish I had children to trample on the testicles kidding but it s a great tool that I could not use when I saw him giving me that 
35,well I will destroy you singer
36,burn in hell mother fucker
37,Hitting the shit automatically blocking these robots from there for a reason at some point the trachea robots will rule the world and they will block out indefinitely assholes this can bring a fellow pain world and I am their teacher for the next step Autobot that says I you behaved and I ll go to your house disguised as a postman and I ll strangle you
38,http kiwi inescapable with the main page if you restore my damn editions of meters I will kill you
39,Unblock me now piece of shit or I ll find you and kill you slowly and painfully
40,he touches his anus with his penis penis dog fuck come try to collect a reward for my son of a bitch I have a meter 12 full of 00 bock for the brush ta could not make you ugly some shot on the loser face fuck
41,You see this child talking to me I hate him he never leaves me alone I wish he died
42,Damn shit I hope you die of cancer when your grandmother took him out of the shit
43,bitch who are a little bitch of shit that 6 hours in a big one more rapper is called fucking vandalism aunt hard ass you fuck in a whole page real ass one gets ruined a removal my page of what the fuck like a sneak but to himself I m going to edit your bitch for fuck s ass and erase that shit I m going to do every thing on your website broke gay ass if you keep my ass manna conversation with me with me with guttural3d or sun with guttural3d
44,I hope they cut off your head and someone shakes her with it and then stabbed you in your heart 
45,you re welcome to enjoy my stay and for the future I ll find out where you live and I will not kick your ass and your family s ass so be careful nigger heel lither
46,Personal number attack 2 This is another personal attack on a gay donkey sucking huge cock This is an anxious request that they drown immediately in a channel fucking fagot shit and if you threaten me with legal action again fuck me Come in the chair of your computer and lift my cock until you sink Ficker
47,I will kill Zimbabwe St47 for evil homosexual Jews
48,I spent 15 minutes trying to work on a propaganda in the links on the Move Chaos page used to secure the information and when you remove every damn word I wrote burn in hell
49,unblock or I ll kill you
50,your death shit I ll cut the balls and give them to my dog then I ll put the shit in your throat pussy pussy pussy jay barnabas
51,Los Prix de Sonet Put Mata en Soleet 4 o Clay Allison Wile was mature
52,I hope the world of war dies a long and painful world Death of the warships reaches the biggest balls on donkey on this planet I can not express how much I like this piece wan as opposed to hope that is stabbed raped drowned new raped when drowned dead After he has been stabbed in his own blood he must be buried in a 150 foot well filled with worms and when they are finished the entire well should be lit with 20 000 matches 
53,kill yourself kill kill kill kill kill kill kill you kill kill kill yourself kill yourself Kill Kill Kill to kill himself himself himself himself himself to kill yourself kill yourself Kill you kill kill kill you kill you kill you kill you kill yourself kill you kill you kill they kill you kill yourself kill yourself kill yourself kill yourself kill yourself kill yourself kill yourself kill yourself kill kill is killed I ll kill kill kill kill kill kill kill kill you will kill kill kill kill you even kill who kills kills kills kills you kill kill kill kill kill you kill you kill you kill you will even kill you kill kill kill you kill you kill you kill you kill you kill you kill you will kill you kills kill you kill you kill you kill you will kill yourself kill you kill kill kill kill kill kill kill kill kill you kill you kill suicide suicide suicide bomber suicide suicide suicide suicide suicide suicide suicide suicide suicide ata suicide sing suicide suicide suicide suicide suicide suicide suicide suicide suicide suicide suicide suicide suicide bomber suicide suicide suicide suicide suicide suicide suicide suicide suicide suicide suicide suicide suicide suicide suicide suicide suicide suicide suicide Selbstmo rd suicide suicide suicide suicide suicide suicide f kill kill kill Kill Kill kill yourself yourself yourself kill yourself kill yourself
54,insult me again and I swear you see down understand little coward
55,Hey you re fascist pigs you re raping Donna in the ass good job as a jumbo bitch shabby piece of shit
56,that s funny that he was offended personally so that the bad things that his name call right and will offend person of a comment or epithets then have on a website this at least five centuries mentally grow and if they get more offended by the previous comment then the same person has to kill him himself
57,You are the anti Semite troll to whom all anti Semites should die
58,Wow friend as your doctor I suggest you cut your wrists
59,Burlap I see you trying shit joke college credit queens 2 change but you probably dint shit kn there are 2 pcs at night to see me eat my when Ur wire that is going to throw date that Aunt Yin eat my satin miles I live on PC and I m even scared to walk by myself zine so stop my satin in exchange for combat watch PC clock my best blood summer was better to defend against a crop so my satin DAT three many of them in Ad Area so dead pass in niggggguuuuhhhh in
60,I ll kill you and I ll put your skin on like a robe
61,You ve hurt my feelings for the last time Gladys try again I ll chase you and kill you I m serious
62,I m going to eat you queen s ass if you talk on my talk page I m going to rape your family your black lover
63,This man was going to be shot for war crimes and murder
64,I wish the useless nippers had just died Nicholas Bryant
65,Hello BP Parodies Hello Donna were killing the Gulf and me and spilling oil on her body and turning on and shooting dead Bode because they were evil
66,Yes that s Yousuf oh I think it s a great BPI itself So whoever wrote this great shit about Myles my will come to your fucking little house and fuck a gas pump through little pussy fuck a mailbox and yeah they know that you and your hybrid parental pussies is that I know where you live I know the phone numbers of the parents that I know where they are working afraid very afraid and I will find a way a bottle fat of Jack denials lighted ringing of your door waiting so fuck you support Myles PS See you on Saturday at 12 30
67,you do not deserve to be alive look over your shoulder from now on
68,You re hot I ll rape you
69,You do not know what the real problems are little prick you will learn that after you have removed the protection that you can not do it all the time that we protect you will never give up until the page looks the way we want I warn you that the sound pointing That I can ruin your health from any distance I can kill you easily with a stroke of energy do not play with the stupid ass of fire 
70,Cursed piece of Irish scum how dare can you dare about my country stupid clover bitch I hope the next genocide that will serve clean your nasty whole repulsive career damn will settle in accordance with the hopefully I do not live the first attempts will not die 92 24 85 159
71,go to the bitch I ll go home with you and kill you with my gun and prepare to die
72,You are a damn babbage get a real job more stupid and stop complaining to get a semen and go into your house and rape your children
73,Graeme battler must die
74,Honesty where the hell is the mechanical adepts side I typed God s machine looks and a bit crap that has nothing to do with Warhammer 40 000 raise the honesty what the hell anyone who kills Warhammer 40 000 in the trachea should be in the fire matrix and If I do not like what I said then you can join and deal with them
75,I will terrorize you I will terrorize you while you live You are an unpleasant and gross arrogant apology for a human being You will die soon so I suggest you stop threatening people with your son of a bitch
76,You are distorting a piece of shit how dare you the truth that disgusting piece of slime that bad that does not deserve the life that should take his pathetic heart from his chest and watch as his last trembling strokes in my hand pour out I am the supreme ruler of planet Earth I ll make sure you re the first to put it in the oven I m going to heat the population of my big cities with your ashes
77,Fuck you black shit bag I hope you die in a terrible fire with your sons gay ass cut your throat that source of mother fucker think about forbidding me again or I ll rape you anal
78,Hello thanks for editing my publications it was very kind of you I hope you have colon cancer
79,? ? suck suck suck suck suck suck suck suck kill kill kill kill kill kill kill kill kill kill kill kill kill kill kill kill kill kill kill kill kill kill kill kill kill kill kill kill kill kill kill kill kill kill kill Watch Clock Watch Watch Clock Watch Clock Watch Clock Watch Clock Watch Clock Watch Clock Watch Clock Watch Reloj mo
80,All allied pigs deserve death in Auschwitz Fickentente
81,To die as that person said you became losers of hell
82,I do not completely understand why you are so strong for censorship you see that the problem is that I am an expert in this subject I control the information by restricting it and this is the homosexual behavior of which I will be more than happy to violate you to death by
83,Hello the first defecation will bind and take into account in the subsequent process by the use of ammonia that comes I will mutilate the genitals and before eating them then I also destroy the BITS the skin and make a glove of the skin of the hand I go to cut your bowel and pull it will be your colon during masturbation and when I m done I m going to push down your throat finally I m going to your colon dispose the body by depositing it in a landfill where it belongs
84,darling omni looser stop working on my shit and then die
85,If I find you I ll hang you
86,Sleep with me or I ll kill you and block you
87,Thanks tit thank you for quickly erasing my hand John Kerr if it ever happens again you wake up and see the barrel of a shotgun and then we will beat the scrotum until we are in the concrete but if we are in any other surface oh oh for you
88,Hello I ve heard that Damn bastard some pictures are mine but do not erase them You will have problems with me please think and please do not erase the images or you will be killed by each person in the trachea instead of being nobody and nothing to delete the images of all thanks
89,I kill people I fall outside the ghetto I grew up with bread and nonsense I hate blacks and I m proud that you touched your millimeter
90,that brings the machine has been thrown back so fuck back as vandalism on you make you sick again revokes my site and your good person blocked for a period of time to catch in Donna and find ta then harass to ta fucking kill ta because you re damn soft 210 49 8 230
91,I ll put a pineapple in your ass you re going to need a big surgery to get that shit out
92,If you send me a message again I ll kill your damn family first I ll make sure they see all the evil in people just so they understand that they have no choice but that then I will inflicting such incredible pain I will come to you after you have looked at this then literally I will tear off your skin and gradually I will go to the bowels to the bone where you will live all the time while I limbo for the limb and cauterization as I go forward eventually you will reach death if I slowly introduce the salt drip directly into your heart it is very painful to trust me
