,es
250,I ll deny that you stopped harassing I m the same IP that you block I m going to destroy Donna
251,Are you going to enter the Deesstalks for which you are condemned or do you crawl back to your hug box or hang yourself 
252,your bastard fucks you okay I hate you stop canceling my edits I ll kill you fuck you and fuck myself asshole
253,Communists must shoot the communists as traitors for all the communists who start with you
254,a knife for you a knife for you one of these days I ll cut you into little pieces
255,Eat shit damn shit Jew damn Arab I ll kill you 1
256,go and fuck off and die 68 0 119 139
257,I will kill your pets and cut your hoops You are such a big clown My name is salvado and I am a gay soccer player I play for the crows and I love the cock 
258,do it again and I will hack your computer destroy your disk and then track your IP address where you live
259,Siege heel heel you gay boon I m Donna cut your brain
260,unlock all life prohibition of expulsion lifelong suspension I want to live damn bail lifetime suspension of beaver and head butt Jessica Simpson niggard 420 moon fuck dissolve permanent expulsion banned live I want to catch the crime of life erupting beaver and butt head Jessica Simpson niggard 420 moon fuck cancel permanent banned live banned wants slut life banned beaver break and butt head Jessica Simpson niggard 420 moon fuck dissolve lifetime ban that live banned wants beaver breakup suspension of damn life and butt head Jessica Simpson niggard 420 moon fuck cancel all life expulsion banned live I want slut live bail lifetime suspension out of beaver and the mind of Jessica Simpson niggard 420 moonlight Fuck you pick up all life suspension lifelong ban I want to fuck you life long suspension triggered beaver and crash bezas Jessica Simpson niggard 420 moon fuck to choose life prohibition of lifetime suspension that w catch sick by suspension of life strong beaver and head butt Jessica Simpson niggard 420 Moonshine fuck unlock life prohibition ban of life will be fucking beaver rupture lifelong suspension and butt head Jessica Simpson niggard 420 moon fuck dissolve permanent expulsion Vivo banned wants beaver breakup lifelong suspension fucking and head butt Jessica Simpson niggard 420 moon fuck cancel lifetime expulsion banned live me fucking lifelong suspension beaver break and butt head Jessica Simpson niggard 420 moon fucker unlocking life Lifetime suspension ban I will condemn for life beaver deposit ban and butt head Jessica Simpson niggard 420 lifetime suspension Unblockierung life ban of moonlight bitch I want suspension of life damn chaste r reservoir and butt head Jessica Simpson niggard 420 moon ban of unlocking fuck of life I live banned wants beaver breakup lifelong damn suspension and back Kop Jessica Simpson niggard 420 moon fuck cancel all life expulsion banned live yo fucking beaver breaking lifelong suspension and butt head Jessica Simpson niggard 420 moon fuck lifelong suspension unlocked life long suspension I want to save life long suspension doomed beaver head d rear Jessica Simpson niggard 420 Moonlight fuck cancel the expulsion of all the life exile of a lifetime I will condemn the whole life of beaver breaking expulsion and the ass Jessica Simpson niggard 420 moon fuck to choose the exile expulsion of all life of a lifetime I will condemn the whole life of beaver breakup exile and head butt Jessica Simpson niggard 420 moon fuck unlocking suspension for life banned live me fucking life banned the beaver rest and the butt head Jessica Simpson niggard 420 moon fuck cancel the permanent expulsion live forbidden wants beaver breakup lifelong suspension damn and head butt Jessic a Simpson niggard 420 moon fuck unlocking life lifelong suspension I add reference will condemn expulsion life beaver break and butt head Jessica Simpson niggard 420 moon fuck dissolve permanent expulsion Live forbidden wants beaver fuck for life break banishment and head butt Jessica Simpson niggard 420 moon fuck cancel permanent bans live banned wants beaver suspension tank lifelong damn and head butt Jessica Simpson niggard 420 m oonshine fuck unlocking the expulsion of a lifetime I live forbidden wants lifetime suspension damn beaver break and butt head Jessica Simpson niggard 420 Moonshine fuck dissolve the expulsion all the life that I live forbid wants to catch the crime of t ode life erupting beaver and head butt Jessica Simpson niggard 420 moon fuck unblockieren life Lifetime expulsion spell I will condemn the expulsion of a lifetime beaver break and head butt Jessica Simpson niggard 420 mantes chein fuck dissolve the permanent banned banned alive I want to fuck you all life beaver breaking banishment and butt head Jessica Simpson niggard 420 moon fuck cancel permanent banning Live banned wants fucking bail spell live out beaver and Butthead Jessica Simpson niggard 420 moon ban unlocking fuck of life I live forbidden I want to live doomed banned beaver rest and head butt Jessica Simpson niggard 420 moon fuck life expulsion banned live me fucking beaver breakup lifelong suspension and head butt Jessica Simpson
261,I expire all day after the rape My mother destroys the vagina until it hurts when you start to bleed I start having sex with your mother You son of a bitch American She gives you the anus and the vagina every day for free I ll sing it piece from Brazil that has money slipping inside the vagina is not it 10 year old girl already has in the vagina the Brazilian soccer team is the best in the world Americans humiliate me boner of hell only yours Mother Eat that has returned my article You Sons of Bitches Vagina Mother North American
262,an ugly child and I ll kill you like a cat in a box maybe
263,What the hell what the hell is your fucking problem I m going to sue your damned pants for discriminating against a minority your damned mother cock I ll kill you the next time you try to block everything in my account I do not care you really think the trachea is my life I m not a loser like you
264,From September 2006 I cut it down listen here bitch lets one thing in a row I get orders from a couple of chickens in the bedroom is the freezing of hell days during I m going to fuck you like I do every chicken my hard and rhythmic oh for about 15 minutes and if some stupid stupid ass bitch ever came up to me I would strangle her to death 18 11 9
265,Help if you get a publicist I ll find and kill damn ta because you re a fucking homosexual who does not deserve the update
266,1938 Finland Sweden and Norway had to meet and killed all the Russian war criminals fly that the crazy crazy dictator Stalin sent once and for all the ruthless Russian robbers who have stolen the cleft lip of Finland their anger
267,Goodbye I ll kill you
268,Stop being a shit or I ll rip your head off and lower your throat Son of a bitch we go in
269,Go kill yourself and kill the retarder
270,Stay away from my business keep it up shit head I ll kick your ass
271,You are a pussy go with the 3 in a fire
272,Come on I ll suck your fucking face and fuck your whole family you bastard bastard you suck what are you saying now
273,Hey hole hole I m going to find out where you live and I ll burn your house
274,I am angry with you invoice that people have blocked the time you live asked to stop removing my editions or I will block for all Noes that trachea ass is not censored to stop to remove my fucking news or you defeat him the fool
275,Hole supplied knowing who the shit is but what the ass to block
276,hi say shit you know that by blocking me basic human rights and freedom of expression are violated and eliminating my tirade is just ridiculous that only shows that all that a lot of fascist imbeciles are bombed if death in WWII World now please kindly fuck yourself thanks
277,If you cut your head in the neck it will be very slow and painful according to the policy of the air purifier
278,You ll die in 7 days
279,Sarah Plain is a motherfucker that Nazi stupid woman is a fucking bitch I hope they kill her conservative racist Nazi ugly stupid bitch with glasses and Americans love it because a cum Ku Klux Klan die Sarah stupid racist
280,This is the last warning stop that violates various guidelines for air purification and ceases to be an American obdurate do humanity a favor and kill yourself
281,j Delano s house will be bombed
282,By the way I love intimidating so try to ban me for a year to stop me I wish you would die I would rape you your mother and your friend s gay ass
283,new prize well done the iamthecoinman They are very annoying and they are good at barn stars anti vandalism I leave them the iamthecoinman They are very annoying and they are good at barn star antivandalism for their quickest to my kiwi protection prank It is important and an unimportant task below is to protect other tragedy services your efforts will not be greatly appreciated I hope someone will cut your hands
284,Ban and you will understand
285,I ll put a pineapple in your ass you re going to need a big surgery to get that shit out
286,I m on top of the head with a shovel I m close ta down bpi
287,I ll kill you and I ll put your skin on like a robe
288,Do it and I ll cut you
289,quirky 3 please other people do not make repeated changes if you continue you can be blocked from the edit of the trachea Note that the three restoration rule prohibits more than three reversals in a content dispute within a period of 24 hours plus users of that a large number of carry backs in content disputes can be blocked by war of editions although technically not revoking the rule of three instead of revising the conflicting modifications in the discussion page the desired revision is implemented not be war of editions Thanks PTO You are in 3 reversing my in two you have broken the rules
290,I will strike your skull and urinate your body I will beat your skull and urinate your body 
291,you are so ugly bitch Walters are that it is another fat ugly losers stitch on this page I can not believe what is delayed fagot rate what I have discovered where I live to keep going and block this IP I will not be anymore Anyone in the future that what use is not me you are wrong and you can not handle the truth you undo the good work but you never do a good job only bad returns and editions I will follow many of your edits and error and see that you are so inconsistent and incorrect nobody is going to cry re you a fat sucker and an ass lick here you think it s all that but you re dirt so you have to compensate Looking for a bully here is not consistent or logically you will find dozens of articles lists of people from shows to parades to include other activities and events that are considered important to read the following articles to which some participating editors and messages to insert the tip and remove your work even after having been there for years all you are a pain loser pussy without queue that lutschst other men to make you feel better the amount of loser is you think you are important to go and undo the I work one trillion UPS and I am a creative ad that could take down but I will do from this side n are Donna want to Never fucked with me and with my team here is a worthless hammer head no sense that you re a piece of shit to fuck and die I m not going to read your stupid notes or pussy answers I could care less about that in this place there will no longer be The place that appears in the search for IP is just a bounce the way to launch people that even in the city or state but has not registered thing joke for you Hong Kong Dong I already use other planes to edit objects that do not come in luck or drink shit I care little about the article itself where I have worked and I have returned you do not make a life ps what is best for the trachea as you say not to be so jealous and angry so in an EFFO to get revenge go to work out of shit regret that has already been confirmed can do the job or stop undoing the changes and as an idiot you portray well you are unproductive and annoying that you are a psychopath with serious mental problems and they have discarded The one that will have the content does not like it does not give you the right to do it reverted only you become a knife and eliminate sitting hear about a discussion page of conflict resolution rules and think consensus do not apply kiss to ass you want your finished my mana was the race go from here and listen to your idiocy or otherwise and yes it is therefore a threat to block this IP for a while I do not take a bit of funny white garbage to black and examined who cares if someone was a fan or not 90 of the people who edit an article amateurs or experts grow up on the subject and sees the cum sperm in their long curly rudely rubbing their greasy looking hair and call it a life Do you have a weapon that you use on your face vegetable sponge
292,Shut up of course I said it I hate you and I wish you the death of wood
293,Samuel if you do not want to be the one who dies be better as you want or we will keep hitting
294,And to the party that fucks me shit I ll be back in five minutes and hopefully Sandman s head wheel will clean my ass and your body will be away from your head
295,I will attack you 32 210 212 23
296,I am Donna cut the damn balls of bastard of India to see the content posted for the handling of personal information is Gay Wahhabi
297,yards fuck idiot what does not have to eh yards live this life in lice po crew come to dye ?rang the gun and go yards down I see cover Kinderaugen you tell me you know more about yards when Du training Nottingham even vein do not you know that Rio Ferdinand read the papers to get rid of if the rings the fact is done because ignorant white boys pig not even Nottingham London or Brighton where yards is the lifestyle that is bundled with my travel length then I follow you you I show my weapon and orang you fall good day to you
298,Stupid stupid FK my great great grandfather was the main the biggest Sikh singing midwives are scum like you who has to be executed who deserves stupid version Every stupid FK in my family more than 500 members have been baptized Khalid Sikhs that you were Khalid Sikhs for more than 400 years you are stupid because you insulted me and broke the teachings of the guru Sahib you deserve death you re stupid
299,The next time this happens I will not report it I m going to eat your children rarghhhh you can not fuck me I m the damn heavyweight world champion I ll eat your face
300,you just wait for your death to be near
301,I come to look for you I know where you live and I will come to violate you
302,If I find you on the street I will kick to Ur Ass
303,Leave this shit one day something bad will happen to you yes that s a threat
304,I ll fuck you your Irish thought fuck your mother
305,I will kill you all I mean it you re all losing retarders who deserve to die and I ll make sure each one of you suffers a horrible death 
306,I ll kill you ink sunrise your a garbage and a fag and you have to die I ll kill you if someone else protects your user space better because I m going to vandalize it
307,I m not talking about the trachea I m talking about real life everybody except for you the Gay Reeks should be well treated they should be working
308,Due to your censorship and abuse control I will kill you I ll go to New Orleans and blow your house piece of shit 86 134 181 35
309,Dear Seabrook your days are numbered the knife is on its way preparing for terrible horrible things you are a fucking cock of aspirin
310,fdsgdfgfd why do not you die talking 
311,Damn black how dare you undo my edits I will hunt and rape you until you have cut your internal organs 
312,Look here gay little penis You look better in your mouth or you are thrown in kiwi means Funking you see but you look at your life is überrrrrrrrrrrrrrrrrrrr
313,Glenn Beck is a sissy he likes cock in the ass I like to cut off his head
314,urgently your own business motherfucker stop motherfucker change my shit shit you eat a mutual son of a bitch dick beat me ass come find me niggard I go here
315,Block me I challenge you Hey do not tell me what I can do and what I can do go ahead and block me because if you do I ll have all this damn website closed forever so try wweppvguy
316,First of all I am binding and I remain conscious during the subsequent process by the use of ammonia that comes I am going to mutilate the genitals and lead it then they eat pieces of skin and they provide a glove of cut skin of the hands then the intestine is cut and pulled that his colon would make his two points for masturbation and when I m done I ll push him in the neck finally I ll dispose the body by depositing it in a landfill where it belongs
317,I like you I kill you the last
318,Miller transgression is believed to be safe in the island of fire that we see bitches is up to the same old age collaborator to add content to know dubious import this time the photos of phi TA Miller that bitch needs tresst really her ass good and hard for her Rub continue to connect with him despite the constant and growing threat to his welfare and personal safety as always the big mouth is his destruction tell us where you will be you think it is harder for you to monkeys in Phi as In the city look around you see places where someone can wait for you damn it but listen we want to be fair We give you a head We warn you against Columbia we can not say hi hello too maybe this time we re patient pretend you re crossing the street look to the right and to the left but look behind you too and look a lot in front of you and do it all the time because you never know when we could pass How could it be how should we express it Oh yes you can dodge a bullet I hope to see you soon you will not see us 72 76 10 207
319,Fuck you because I give a damn point to the word where I suspect your point in it points you stupid asshole but you can not go fuck yourself I hope you die
320,well I hope you die installer
321,Hi scary kid I m starting to work on this trachea when I go to other user pages I find his creepy little head fucking from the left side of the screen it s unpleasant in the adult and I need no warning that he could ask one of his programmer to stop to let the creepy shit head on the left side of the screens that shows My brother asks me to kill you when I have to see him again and he said he would greet the user Marseille 
322,My thoughts are a damn piece of shit dying and burning in hell
323,you are a puppet of socks it is you I will follow you and if I find that you are in your own sins you will drown you will go to hell I want to go to hell that is probably the boy with the pockets who by the way blocks to the witch 
324,RV you are talking about my RV edit it back or I will destroy you
325,Dust filter if you turn it on again I ll kill you I ll block you I ll erase your conversation page I ll steal your password I ll protect you I ll block you the dust filters if you turn it over I ll curse you bloody block I ll do it delete your discussion page I ll steal your password I ll check it I ll block it dust filter If I turn it back on I ll kill it I ll block it I ll empty your discussion page I ll steal your password I ll occupy it I ll block it Dust filter if you put it back on I ll kill you I will block you I will erase your conversation page I will steal your password I will take charge I will block you if you turn it over again I will remove the filter I will kill you I will block you Be your conversation page au I ll steal your password I will protect you I will block you Dust filter If you turn again I ll kill you I will block you I will empty your discussion page I will steal your password I will take you I ll block you if you filter you do it again I ll kill you I ll block you I ll erase your discussion page I ll steal your password I ll take over I ll block you the dust filters if you turn again I ll kill you I ll block it I ll be your talk page Delete I ll steal your password I ll guide you I ll block you Dust filter If you turn it on again I ll kill you I ll block you I ll empty the conversation page I ll steal your password I ll take you I ll block the dust filters If you turn it on again I ll kill you I ll block you I ll empty your conversation page I ll steal your password I ll take care of you I ll block the dust filters If you turn it on again I ll kill you I ll block you I ll remove your talk page I ll steal your password I ll get you I ll block your dust filters If you turn it on again I ll kill you I will block you I will skip your speech I will steal your password I ll protect you I will block you Filters of fil If you reject him I will kill you I will block you I will delete your conversation page I will steal your password I will replace you I will block you Dust filter If you kill him again I ll kill you I will block it I will remove your discussion page I will steal your password I ll look for you I ll block you n Dust filter If you turn it on again I ll kill you I ll block you I ll empty the conversation page I ll steal your password I ll do it I ll take you I ll block the dust filters If you turn back I ll kill you I ll block you I ll empty your conversation page I ll steal your password I ll protect you I ll block the dust filter If you turn it back on I ll kill you I ll block you I ll remove your talk page I ll steal your password I ll guide you I ll take away the blocked dust If you turn it on again I ll kill you I ll block you I ll skip your speech Page I ll steal your password I ll protect you I ll block the dust filter If you turn it back I ll kill you I ll block you I ll empty your talk page I ll be your passwo I ll take care of you I ll block the dust filters If you turn it on again I ll condemn you I ll block you I ll remove your page of discussion I ll steal your password I ll take care of you I ll block the dust filter If you go back ah acerlo I ll kill you I ll block you I ll empty your talk page I ll steal your password I ll take it from you I ll block the dust filter If you turn it back I ll kill you I ll block you I ll erase your conversation page I ll steal your password I ll take you with you I ll block you dust filter If you turn it on again I ll kill you I ll block you I ll delete the conversation page I ll steal your password I ll protect you I ll block the dust filter If you turn it on again I ll kill you I ll block you I ll empty your talk page I ll steal your password I ll take care of you I ll block you dust filter if you burst it again I ll kill you I ll block you I ll empty your conversation page I ll steal your password I ll control you I ll block your dust filters If you turn it on again I ll kill you I ll block you I ll delete your talk page I ll steal your password I ll move I ll block your dust filters If you turn it on again it kills you ré I ll block you I ll empty your conversation page I ll steal your password I ll take care of that I ll block the dust filter if you turn it on again I ll do it
326,blah your thick dike pussy if damn you reread in your life you would see that I had a reason not to prohibit my spell was unjustly continued but you do not listen and you sit in your fat ass and you throw the block in indefinite time button is not the Just pussy bag I hope you get hit by the kisses of a car
327,If you block this account I will rape your children damn Admen
328,I do not like to listen to the son of a bitch from my source tell me MY smash things or get sick and smash the ugly face get sick and find that mushhhhhhhhh fat ass and thank you for giving me the sandbox Mugabe
329,Who are you shitting pussycats to tell me I m not welcome here fucking I go twice piss all deserve to gas
330,All of them will burn in hell you know Jenny Mac
331,I hope that your backward children are raped and anally anally because they have a fagot like a father in the Donna fuck your fat woman and for her on the other side of the bridge consider yourself lucky another useful editor of retired Wilkie I see more users do not even dare every day he retired to take away the peace of the shit that do whatever he wants with my page reports talk about everything he wants old kitten do not give one shit and he left me not even an alert template nick to myself that s what you do best
332,I m going to kill you all I mean it you are evil idiots who deserve to die and I m going to throw you all in a shredder
333,Edit the Vandal Stop or Die edition
334,How about I cut your ball and send it to your girlfriend I m sure you ll like that Wait you even have a girlfriend it does not matter I ll send it to your friend
335,This person is communist and must be taken outside and thrown as a traitor
336,I also burn Jews for fun
337,Goodbye I think that means you ll cry more for the Nazis what s your problem with the Nazis You found a Nazi woman and you broke your heart what a pity that your life is worth more Do you know that in this way you will feel this way for a long time You probably think about committing suicide for a while to tell you that it s okay do it it will not hurt you be brave all your worries will have to be no more pain all the others do not worry you come through what you want to say it s not your fault it s bad it s your fault you should be ashamed of what what you did and what you did not do Maybe things could have changed if you were so weak You re broken for so long You are proof that God makes mistakes after you did not fail and when we mention the things you did I know what I am talking about I can not believe you did it You are resisting me you are progressing you re supposed to die a long time you know I m doing it right
338,otherwise it would destroy you
