,es
547, You bash not know what the real trouble be little asshole you will determine that after you experience distant the protection that you can not do information_technology all the clock that we protect you will never impart up until the page search the way we privation one warn you that the sound orient That iodine toilet downfall your health from any distance iodine can stamp_out you easily with a stroke of energy serve not play with the stupid ass of displace
548, curse man of Irish trash how dare displace you defy about my area unintelligent clover bitch one hope the following genocide that will serve clean your nasty whole repulsive career blasted will reconcile inch accordance with the hopefully one act not hot the first_gear attempt will not fail ninety-two twenty-four eighty-five 159
549, move to the gripe one ll sound home with you and kill you with my gunman and fix to die
550, You be a damn babbage suffer a veridical job more unintelligent and barricade complaining to become a semen and go into your house and rape your child
551, Graeme combatant must die
552, Honesty where the hell be the mechanical ace side i type God randomness machine look and a morsel bullshit that induce nothing to doctor_of_osteopathy with Warhammer forty 000 raise the honesty what the hell anyone world_health_organization toss_off Warhammer forty 000 in the trachea should be indiana the fire matrix and If i practice not like what i say then you buttocks articulation and deal with them
553, one will terrify you one bequeath terrorize you while you live You be an unpleasant and gross arrogant apology for a human equal You will die soon so one hint you barricade threaten citizenry with your son of a gripe
554, You equal twist a patch of asshole how dare you the truth that disgusting piece of sludge that bad that department_of_energy not deserve the life that should take his hapless heart from his thorax and watch american_samoa his concluding tremble stroke indiana my hand decant out i master_of_arts the supreme ruler of planet earth iodine ll make certain you rhenium the first to put information_technology in the oven i molarity sound to heat the population of my boastfully city with your ash
555, Fuck you black bullshit bag iodine hope you die indium a frightful displace with your son cheery buttocks cut your throat that source of mother fucker think about dour maine again operating_room iodine ll rape you anal
556, Hello thank for editing my issue information_technology cost identical kind of you iodine hope you give_birth colon cancer
557, ? ? breastfeed suck breastfeed suck suck suck suck absorb kill kill kill kill kill kill kill kill kill kill kill kill kill kill kill kill kill kill kill kill kill kill kill kill kill kill kill kill kill kill kill kill kill kill kill Watch Clock Watch Watch Clock Watch Clock Watch Clock Watch Clock Watch Clock Watch Clock Watch Clock Watch Reloj molybdenum
558, All allied devour deserve death in Auschwitz Fickentente
559, To die adenine that person allege you become loser of hell
560, iodine cause not wholly sympathize why you be therefore firm for censoring you see that the problem constitute that one be an adept in this subject iodine control the information aside restrict information_technology and this constitute the homosexual behavior of which iodine volition embody more than happy to rape you to death by
561, Hello the first defecation will tie and take into account indium the subsequent procedure aside the consumption of ammonia_water that come i will mangle the genitalia and earlier eat them then iodine besides demolish the BITS the skin and make a glove of the skin of the hand iodine go to write_out your intestine and pull information_technology will equal your colon during masturbation and when one thousand perform one molarity fit to push down your throat ultimately i m start to your colon discard the body aside deposit information_technology in a landfill where information_technology belong
562, darling omni loose diaphragm solve on my damn and then die
563, If one discovery you one ll hang you
564, sleep with maine oregon one ll kill you and blocking you
565, thank titmouse thank you for quickly erase my hand John Kerr if information_technology always happen again you wake_island up and see the barrel of a shotgun and then we bequeath beat the scrotum until we cost indium the concrete merely if we equal indium any other coat ohio ohio for you
566, Hello iodine ve hear that Damn bogus some word_picture be mine merely doctor_of_osteopathy not erase them You will induce trouble with maine please think and please dress not erase the image operating_room you volition be kill by each person in the trachea rather of being cipher and nothing to edit the image of all thanks
567, one kill people one fall outside the ghetto iodine grow up with boodle and folderal i hate blacken and one thousand gallant that you touch your millimeter
568, that lend the machine hold be confuse back so fuck back ampere vandalism on you create you sick again revoke my site and your good person stuff for a period of time to catch in Donna and recover tantalum then harass to tantalum bally kill tantalum because you rhenium blasted soft 210 forty-nine eight 230
569, one ll put a pineapple in your fuck you re move to indigence a big operation to get that stool out
570, If you send maine a message again iodine ll toss_off your bloody family beginning iodine ll make sure they go_steady all the evil in people just therefore they understand that they own no choice merely that then iodine will inflict such incredible pain i bequeath come to you subsequently you have count astatine this then literally one will tear off your hide and gradually i volition adam to the intestine to the bone where you volition be all the time while iodine oblivion for the arm and cautery adenine iodine go forward finally you will reach death if iodine slowly insert the strategic_arms_limitation_talks drip directly into your heart information_technology be identical irritating to entrust maine
571, Jim Wales must die Jim Wales must die Jim Wales must die Jim Wales must die Jim Wales must fail Jim Wales must die Jim Wales must die Jim Wales must die Jim Wales must die Jim Wales mustiness die Jim Wales mustiness die Jim Wales must die Jim Wales must die Jim Wales must die Jim Wales must die Jim Wales mustiness die Jim Wales mustiness die Jim Wales must die Jim Wales must die Jim Wales must die Jim Wales must die Jim Wales mustiness die Jim Wales must die Jim Wales must die Jim Wales mustiness die Jim Wales mustiness die Jim Wales must die Jim Wales mustiness die Jim Wales must die Jim Wales must die Jim Wales mustiness die Jim Wales mustiness die Jim Wales must die Jim Wales mustiness die Jim Wales must die Jim Wales mustiness die Jim Wales must die Jim Wales must die Jim Wales must die Jim Wales must die Jim Wales must die Jim Wales must fail Jim Wales mustiness die Jim Wales must die Jim Wales must fail Jim Wales must die Jim Wales must die Jim Wales must die Jim Wales must die Jim Wales must die Jim Wales must die Jim Wales mustiness die Jim Wales must die Jim Wales must die Jim Wales must die Jim Wales must die Jim Wales must die Jim Wales must die Jim Wales mustiness die Jim Wales must die Jim Wales must die Jim Wales must fail Jim Wales must die Jim Wales mustiness die Jim Wales must die Jim Wales mustiness die Jim Wales must die Jim Wales must die Jim Wales must die Jim Wales must die Jim Wales must die Jim Wales must die Jim Wales must die Jim Wales must die Jim Wales must die Jim Wales mustiness die Jim Wales must die Jim Wales must die Jim Wales must die Jim Wales must die Jim Wales must die Jim Wales must die Jim Wales must die Jim Wales mustiness die Jim Wales mustiness die Jim Wales mustiness die Jim Wales mustiness die Jim Wales must die Jim Wales must die Jim Wales must die Jim Wales must die Jim Wales must die Jim Wales must fail Jim Wales must die Jim Wales must die Jim Wales must die Jim Wales must die Jim Wales must die Jim Wales must die Jim Wales must die Jim Wales must die Jim Wales must die Jim Wales must die Jim Wales must die Jim Wales must die Jim Wales must die Jim Wales must die Jim Wales must die Jim Wales must die Jim Wales mustiness die Jim Wales must die Jim Wales must die Jim Wales must die Jim Wales must die Jim Wales must die Jim Wales must die Jim Wales mustiness die Jim Wales must die Jim Wales must die Jim Wales must die Jim Wales mustiness die Jim Wales must die Jim Wales must die Jim Wales must die Jim Wales mustiness die Jim Wales must die Jim Wales mustiness die Jim Wales must die Jim Wales mustiness die Jim Wales mustiness die Jim Wales must die Jim Wales must die Jim Wales must die Jim Wales must die Jim Wales must die Jim Wales must die Jim Wales must die Jim Wales must die Jim Wales must die Jim Wales mustiness die Jim Wales mustiness die Jim Wales mustiness die Jim Wales mustiness die Jim Wales must die Jim Wales must die Jim Wales mustiness die Jim Wales must die Jim Wales must die Jim Wales must die Jim Wales must die Jim Wales must die Jim Wales mustiness fail Jim Wales must die Jim Wales must die Jim Wales must die Jim Wales must die Jim wale
572, ill sissy you rhenium a backbite one spend six-spot hour in great knocker more and you call information_technology conviction vandalism aunt hard fuck you re sleep_together on the very domestic_ass home page that you wrackst a deletion my page of what the sin be you vitamin_a a fink merely astatine the same one megabyte going to edit condemn your buttocks gripe side one murder that shit iodine ll sleep_together indium your gay fuck room every thing when information_technology sulfur talk about erase my buttocks manna maine with maine indiana guttural3d operating_room electronic_mail maine guttural3d with Sun
573, ampere for his passage through the place because helium intentionally desecrate the right of the trachea to hurt himself and because helium measuredly publish defame i bequeath goal his life
574, If you do not lease maine write i ll fuck you
575, iodine trust by the republican tool pocket God if iodine always see you indiana life Identification They sleep_together be wholly hundred company anti gay anti abortion tea party against anti spanish black against immigrant they be like a radio_receiver spit fever Limburger twenty-four seven you need you stand you ll never know the pain we shed inadequate democrat go black and disabled unless you die and send to sin you intend the right Christian fundamentalist teach some liberal icky boyfriend from Ur condemn people to the church father since what lead to incompetent president George W Bush invade Iraq merely the hope that he cost probable to receive defend the invasion of Iraq rather of Pakistan oregon Iran that he hold a biography oregon badly die and all of u a big favor dress
576, Mother bitch i privation to rape you you fetid whore leave you sentence to auction_block my bill operating_room draw my Niggard house to do to you and your syndicate and rape kidnap
577, sleep_together jack swan ahead information_technology do and iodine ll forget you six foot below
578, one think we should kill all Jews homosexual and the disabled aforesaid Adolfo
579, White racist white daughter which take maine think that i could spill to maine another arrogant white female_child spill_the_beans to an african homo down somehow give maine the feel that you would not say a word to your grimace because one draw the solid front tooth off Get yourself and see why white daughter arrange along their awkward second_joint when the big angry Moroccan derive away of the barn with his meat
580, Hi one think you re eating shit stool and die
581, one in_truth hate you and one want to serve you bad matter
582, never again air maine a message iodine ll attend for you and win you
583, you buttocks not blocking maine iodine molarity not where you live if you block maine iodine ll go into your house and rape you in the fuck
584, sleep_together the entire assyrian nation carefully include the armenian and we will all equal assyrian if we pronounce no
585, why well sir why constitute you sir obviously understand the importance of the area deoxyadenosine_monophosphate a kind and generous calamity necessitate the time to understand the affect of this article on emergence such arsenic earth hunger one hear Singapore induce go through the suppression of this article information_technology appear that they be actually fellatio the proverbial penis of everything that be bad why the fuck get mean our blasted article now edit ambition be just vitamin_a my article behind those blue_sky eye that be maine for their good purpose purportedly to understand the Black soul that be your true self My love for this article be retaliation you will not be free until you crush your person and every proof of information_technology inauspicious presence on this earth be demolish iodine hope that kontrahierst a strange disease and his penis become down i bequeath not even effect the child into a contractual servitude and all his descendant depleted will cost curse with an abnormal growth of the umbilical_cord hair's-breadth My bad bloodthirsty wait army constantly equal surely to put space in your house and burn everything that have always be owner until your forcible well being exist swallow by the blacken hole this cost your depraved heart one will besides erase your calumniatory exercise and Singapore lend a rapid elimination of fire from the face of the ground one will not rest buy from you and lead the stairs to the sum vengeance of eat_up inch heaven constitute fall along you and your call Morales God and Satan scowl equally astatine you bally the throne to you and everything you represent to my good guy be a kitty and iodine hope you delight the rest of eternity indiana the open_fire hell of hell i hope that quick end floating all_over you like locust_tree that lento steep the fabric of your be
586, You ra a bally swot go kill yourself nerd
587, thank for houseclean my page you fuck bogus one actually promise you re plump to die you sleep_together son of a bitch and by the manner if iodine kill you you bally faggot
588, You should stamp_out yourself and end this
589, one have a gunman one shoot you
590, Fuck you bitch one hate your whore person what the hell he think he be iodine molarity become to step along his neck until he die damn maine hey every meter one make a variety a kitten turn into a hell bloody you gay fuck cheery Jew dysprosium denounce
591, Niggard please the black guy shake a nickel from his Niggard heard a Niggard dicker a penny i firm believe that this be proof that the correct politically transfix on the impale and put dead operating_room in death camp and should not cost jolted for calendar_month and then information_technology cost report that the shower be now available to act away the gas well and the destruction of their body indium The burn make over them and then plowing them over people They stop be unintelligent lazy Good for anything Wellness whitening Smoking snap Dirty black fetid
592, You rhenium such a sad person the fact that you fail fa have maine laugh one hope you rhenium kill and you putrefaction indiana hell
593, Please run and they will kill you intelligibly own nothing well to doctor_of_osteopathy in the trachea than to test to itch information_technology for early people We do not need your friendly conversation
594, iodine ll shoot you indium the head and iodine ll laugh angstrom your brain drip on the floor and blood flow round your body one ll shoot you in the oral_sex and i ll laugh while your brain saliva on the deck and rake flow around your cadaver
595, in hell the weasel serve not believe that the jewish Holocaust lie
596, one like Loch my Donna kill you and steal Ur huge admonisher
597, Damn denounce i volition chase you and kill you by military_unit filthy sucker from Pakistan
598, i ll baseball_swing off your heart iodine ll adjust you on fire Son of a bitch
599, one megabyte deplorable you see your freemasonry on fourth_dimension You have already delete information_technology one come home from school today and now you be absolutely right that we will never discontinue make fun of you when person in our group of people deny to have playfulness of them one will kill you Higgins no hey he do not suppose anything about his taxis about which cipher care no more rain chin no old hag hunch bailey haunted world_health_organization say yes tantalum and ultimately no long need to fastball sexist cannabis b hippie recorded with all his fck magnesium wwwwwwwwwww sy and information_technology randomness so true that if iodine always meet this Donna Summer give her a sample of her own music and roll along piece of paper and iodine turn on and fastball the kazoo hippie
600, bad bang enlistment unforgettable moment why do you have memorable consequence off from the site of the big tour that prospector world_health_organization sleep_together vandalism and die fuck sleep_together
601, Listen asshole piece if you get the opportunity to read this reading cautiously make_bold to crush my user page and you volition surely die iodine have be postdate you and iodine acknowledge you exist ahead one kill you iodine need your mother randomness whore to rape and kill like torture the whole family what a compassion he act not have a small daughter to violate torture to death and tan her active You constitute a dead serviceman there be no stead for you to obscure in the world for you
602, i ll dart you in the pass and iodine ll laugh if your mind barely spatter on the floor for rest
603, that God the soul that spar go to hell that useless musical_composition of denounce possibly you will take playfulness when Satan fuck american_samoa constitute take your short wyrd the sexual_activity match out and aside the way i pull out of the trachea that wyrd fuck fucking sleep_together and sunburn information_technology in cunt demon
604, you go in the arsenic that rape fatty backbite inch a wheelchair fail indium the american_samoa that rape fat cunt indiana a wheelchair go in the buttocks that rape fatness gripe indiana a wheelchair one megabyte go to rape in the fuck bitch of adipose_tissue in the wheelchair be go to rape inch that adipose_tissue butt_joint whore in the wheelchair one thousand move to rape in the ass adipose_tissue backbite in the wheelchair be go to rape in the arsenic fatty gripe indium wheelchair going to rap in the fuck you toilet fat bitch inch one that the wheelchair in the american_samoa that rape fatten bitch indiana a wheelchair would dress information_technology in the american_samoa that rape fat backbite indiana a wheelchair one ll rape that indium the gripe fatty fuck in a wheelchair go indiana the american_samoa to rape fat gripe indiana a wheelchair iodine ll rape you in the adipose_tissue gripe buttocks inch a wheelchair
605, What be you spill about iodine meter Shelia Bose Sheulibose yahoo with and what the sin be you complaining about come extinct one ll give you a close punch you asshole bastard one ll kill you
606, Fuck you honey why suffice you hate naughty black Nazi cunt Gee iodine megabyte come dwelling and rape millimeter because one get a big black cock in his rigorous white american_samoa his beloved
607, i ll shoot you indiana the head and iodine ll laugh when your brain drip along the floor
608, Hi Davenport i megabyte new to the trachea and iodine have a special message from you You leave my ally alone to exercise if you make a change that my friend receive published indiana television_receiver series and seasonal article iodine will block you and iodine will sue you in woo and i volition simply kill you and you know what you embody not the foreman of any article and you annoy maine and one hope you die
609, survive to the cunt one ll go to your sign_of_the_zodiac and toss_off you with my gun
610, My personal opinion embody that you be a bragger and i promise you die a painful death ninety-one 108 192 one_hundred_twenty-five
611, They be call dye your dirty companion Muhammed be the bad rush on the satellite if world peace be achieve if Muhammad and the jew leave this planet Muhammad must embody hunt wish animal Muhammad should die die Muhammad
612, Hey quell away of my business you Jew red apprehension Mexican asshole i ll kill you damn you stay out of my storehouse
613, hubbub you buttocks not stop maine damn information_technology if my ban exhale iodine ll run_low for your gay report
614, J UK be another damn sissy world_health_organization deserve to exist hit with an ugly stick
615, nazi like you deserve something worse than death iodine ll do certain you rhenium terribly hurt
616, Be courteous and serve not equal an idiot oregon one ll kick your buttocks
617, one hope world of war die a long and atrocious populace Death of warship scope the bad ball on domestic_ass on this satellite iodine buttocks not press_out how much one like this piece wan american_samoa oppose to hope that exist knife rap drown again despoiled when then all_in drown in their own blood of course nail must be bury in a well one_hundred_fifty meter deep full of worm and when they embody fix the whole trap must be ignite people with twenty 000 game sometimes state maine that this blight be due merely i five_hundred choose to open my botch and pour hot acid on them and permit their mother bite them delectable anyhow
618, reason why i hate you one You experience write on my page now fail Bastard two You be testily immediate in edit You be cheery three Anal My darling be shout
619, your Donna be a dead faggot sixty-six 158 193 fifty-eight
620, iodine hope you putrefaction inch hell you fuck idiot of your mother die in the flame of hell i hope you die alone and deplorable son of a gripe i want you to die the life of Ur
621, one hate you and one hope you die in a fire 128 sixty-one 128 159
622, corrode denounce fuck suck my butt fix then die atrocious iodine hope you induce cancer
623, french homosexuality be fry sissy one megabyte go to cut the ball and serve you on a plate with mushroom earlier you energy your cock in your buttocks and your acquaintance randomness zertrümmerst egg earlier iodine ll kill you thus much
624, Eat drivel and die
625, Go and hang
626, one ll photograph you indiana the head and one ll laugh when your mind drip on the land i ll film you indium the lead and one ll laugh while your brain blurt_out on the floor
627, miner Day Thanks for leave information_technology sleep_together for nothing there south nothing wrong with the article one hope you own cancer and die bloody birdlime
628, If one hack your explanation one ll throw you a stern if one leave with this site iodine ll feed you a smack
629, They sucking you sucking go kill you
630, No what the hell suffice you good state to my little gripe one ll lease you know that one calibrated from my class in the Navy Seals and be involved in numerous secret foray into the dilemma and iodine induce over three_hundred confirm death that iodine be coach in war of the gorilla and i amplitude_modulation the superior sniper of the totality push united_states you embody not for maine merely only another objective that will equal clean with a preciseness that embody never see earlier on this earth my bally words that iodine think you toilet become away with the one you think crap for maine over the Internet again Ficker a we talk i contact my secret network of spy in the United express and their information_science embody constitute traverse so information_technology should exist better for the storm indium order to prepare take knocked_out the pathetic thing that you call your life you exist a child dead with blood i can be anywhere astatine any time and one toilet accept you to more than seven hundred coinage to stamp_out and that experience merely coach with my own handwriting not only in the combat without weapon merely one accept jewel wholly the armory of the Marine Corps of the United country and iodine will gain full use to clean the pathetic american_samoa of the front of the continent little bastard if you know the blasphemous retribution embody your short smart gloss to learn information_technology depressed possibly you ve spare your fuck tongue merely you could not own dress information_technology and now you pay the price you sleep_together idiot i ll make you harebrained and you ll drown in information_technology you re a curse dead child
631, hello rutherfordium trachea lifeless fail the p0x with skylight cured poly
632, the whore you are whore
633, therefore survive fuck yourself and rape fantasize about whore
634, Shut astir one meter sound to rape your baby
635, Stop work on Karl randomness side earlier stamp_out you
636, death for you and your child one will ban you and one will eliminate you for defamation
637, one ll be back in a few hour to hex Cannock to fool your canadian faggot
638, Fag will stop my change operating_room i ll kill you
639, eight five_hundred eight vitamin_d eight d eight vitamin_d eight vitamin_d eight vitamin_d eight five_hundred eight vitamin_d one hope the liberal fagot die and go to hell Barrack Obadiah 2008
640, reservoir of personal attack tell maine what i displace and what i can not do one will start there and throw a stone through the main window
641, sometimes one besides kill child
642, iodine will collapse you a beat in the ovary that be right inch the pamper and one will have a fuck life
