,es
676, if you remember that sodium_carbonate be nu metal you rhenium a wasteful damn whore and you should sentence yourself indium a firecracker die
677, how to kill Mozart wooooooooooooooooooooooooooo chop him photograph him alternate on him
678, iodine indicate you pay attention to your back because one will bust you to piece
679, Jew the fuck here you asshole Jew that rape your sleep_together kin if you practice not fail after you semite bastard one ll shoot you if you fall back because you re a dirty Semite iodine hope you drown in a fucking muffin we go
680, Sorry copy information_technology and add information_technology to ten token oregon your mother will die indiana the adjacent four hour sixty-two 158 seventy-seven fifty-three
681, run_low big and painfully die lazy hypocrite idiot the road to hell be pave with good intention dense fry
682, J be an angry homosexual tire world_health_organization should be consume alive aside a group of rabid baboon
683, If you do not respect the supertanker you will die forever
684, plank why you cause not accept an article on the gene board be not fair and if you act not induce an article indiana the display_panel until twenty-four 07 one will kill the laminitis of the trachea diagnostic director
685, You be go to attack maine again because one be remember that you be take maine now that one go_steady that you wish to destroy my solve again this time you cost function to die of a bally time
686, i will kill you iodine merely need you to know that
687, Bastard you fat bastard act information_technology by your side get blood from your throat Death in the vent and the group vitamin_d fall back and your blood constitute a sight of glory fatness bastard narrative and follow the diet
688, orderliness dream Jerk have no right to station person to act what helium good go to one of the most despised member of the adversary of the air purifier and do what helium hold to do dagger behind Jack the Ripper fall melt butter indium Rho Manna Bite Play We toilet butter Knife Play
689, i ll come back anytime and then one ll beat your millimeter
690, and he suppose helium would kill maine
691, Billet catch and kill Billet because one hate killing your large and fat tag kill Billet kill fuck stick kill your big adipose_tissue buttocks kill kill your Billet sleep_together Billet killing your ass kill Billet kill Billet hate kill Billet and revenge the hard point to kill her ass
692, Your dazed cunt ohio and i sleep_together your mother last night iodine hope you die
693, iodine hope you die of cancer
694, that second how you spill bloody damn iodine ll go search for you and pang you again and again while you sleep and you ll see how you run to death and you cry and i ll laugh
695, why be you so ill-mannered i just want to avail you mother fucker jack stay you rhenium sol retarded one hope everyone die badly
696, one know information_technology mho England because information_technology say one megabyte sound to flee Britain and Ireland
697, Thameslink be a squat thief and must constitute shoot with wholly the member of his family
698, faggot yo fucker washington curse Hayes du bass no seven seven be with sheep in 2004 you bally cock stopcock you rent right gehammter jump off a bridge that spurt
699, maine and my tongue be Donna cutting you antsy
700, iodine hope you ra hit aside a truck your dirty while of despicable bullshit precisely go kill your human baba
701, The Antananarivo rape constitute all_in operating_room soon information_technology will constitute the question of how well information_technology exist concealment from the raper iodine amplitude_modulation a good seeker
702, iodine ll give you a bloody beat and then one ll shoot your execution style Donna strike you indium a bloody pulp and then shoot your execution expressive_style
703, You ra a sleep_together Jew and you kill yourself
704, iodine bequeath kill you one will kill you
705, You ra useless denounce ampere a concerned citizen i molarity angry and suffer because you would create information_technology not worth information_technology How can you love suffer Miami in this way If iodine always determine you in your life one ll produce information_technology a point i hate your damn intestine iodine promise you burn indiana sin
706, iodine ll kick the shit indiana your cunt
707, What embody your problem why be you angstrom an educational institution that you suffice not have the right to stop an educational mental_hospital one will predict you legal action if they continue against you and against your class and against anyone you love one perform not like information_technology and iodine hope information_technology die soon one will sue you if you continue to bother maine your harassment cost a violation of federal law and one warn you that if you stay you will not like the consequence 216 229 227 gross
708, Queer belly_laugh Ur so damn gay you should die
709, one ll kill you iodine ll fuck your nipple iodine ll pass a knife through your heart fat text
710, silly seat one ll decapitate you
711, Fuck you sad piece of bullshit grant a augury of life threaten maine to stay off from this shit one ll give you a lone hermit Open your curtain and pay_back a life ahead one burn you alive
712, one ll witness you in real life and one ll kill you i ll find you indiana real life and i ll cut your throat Damn miserable worm iodine bequeath kill you and your solid syndicate damn despicable worm
713, You ra a fuck hypocrite iodine hope you rhenium rape and kill by a lunatic like Andrew tomorrow
714, a bong warrior aspect you can face possibly fuck in subject of lose a bally life_sentence some hex weight drug in your sleep_together winery and impart one know there exist many year and information_technology be identical difficult social interaction such american_samoa college for have merely should not accept their train american_samoa they have sacrifice a blockheaded shower bag that no one buttocks stand up and everyone be tease one hope your house apprehension fire and all your comic book and carry_through calculate cursed to sound with your useless while of asshole
715, an despicable despicable azimuth azimuth american_samoa you should act the universe a favor and simply commit suicide
716, i ll look for you one will look for you and doctor_of_osteopathy severe and violent thing for you This be a carnival menace that iodine would lead badly if one be to decapitate you for contemptuous Islam eighty-two one_hundred_sixty-five gross fifty-one
717, i have if you continue to block a hacker with my caprice one volition farewell the trachea to talk to you Theresa dogpenisknot people accept another life that exemption of expression to prevent an unforfeitable right and FATSO like Georgia and the sample and two penny prostitute Karate he induce to sleep_together again if they deny maine a rate to express myself then cipher can fit here one entail information_technology
718, lock improving ampere Flagelo perform not manage one ll decapitate his mother and sleep_together them inch the neck back to Rowland you fuck hypertext_transfer_protocol trachea oregon the kiwi the real Stephen Hawking hypertext_transfer_protocol of the trachea oregon the kiwi the real Stephen Hawking hypertext_transfer_protocol trachea oregon the new_zealander the real Stephen Hawking hypertext_transfer_protocol of the trachea oregon the new_zealander the real Stephen Hawking hypertext_transfer_protocol of the trachea operating_room the kiwi the veridical Stephen Hawking hypertext_transfer_protocol of the trachea operating_room the kiwi the real Stephen Hawking hypertext_transfer_protocol of the trachea oregon the kiwi the actual Stephen Hawking hypertext_transfer_protocol delaware the trachea operating_room the chinese_gooseberry the real Stephen Hawking hypertext_transfer_protocol trachea oregon the kiwi the real Stephen Hawking hypertext_transfer_protocol of the trachea oregon the kiwi the real Stephen Hawking hypertext_transfer_protocol of the trachea oregon the new_zealander the real Stephen Hawking hypertext_transfer_protocol of the trachea operating_room the chinese_gooseberry the true Stephen Hawking hypertext_transfer_protocol trachea operating_room chinese_gooseberry the real Stephen Hawking hypertext_transfer_protocol trachea oregon the very chinese_gooseberry Stephen Hawking hypertext_transfer_protocol trachea operating_room kiwi the substantial Stephen Hawking hypertext_transfer_protocol tra quea oregon the chinese_gooseberry the real Stephen Ha hypertext_transfer_protocol wking of the trachea oregon the chinese_gooseberry the veridical Stephen Hawking hypertext_transfer_protocol of the trachea oregon the kiwi the Rea fifty Stephen Hawking hypertext_transfer_protocol o the new_zealander trachea the real hypertext_transfer_protocol Stephen Hawking trachea operating_room the chinese_gooseberry the real Stephen Hawking hypertext_transfer_protocol operating_room the real kiwi trachea hypertext_transfer_protocol Stephen Hawking operating_room the kiwi trachea the real Stephen Hawking hypertext_transfer_protocol trachea operating_room the kiwi the real Stephen Hawking hypertext_transfer_protocol trachea operating_room the chinese_gooseberry the real Stephen Hawking hypertext_transfer_protocol trachea operating_room chinese_gooseberry the real Stephen Hawking hypertext_transfer_protocol of the trachea oregon the chinese_gooseberry the real Stephen Hawking hypertext_transfer_protocol of the trachea operating_room the chinese_gooseberry the real Stephen Hawking hypertext_transfer_protocol of the trachea oregon the kiwi the actual Stephen Hawking hypertext_transfer_protocol trachea oregon from the real hypertext_transfer_protocol kiwi Stephen Hawking operating_room the kiwi trachea the real hypertext_transfer_protocol Stephen Hawking oregon the kiwi trachea the real Stephen Hawking hypertext_transfer_protocol oregon the new_zealander trachea the real Stephen Hawking hypertext_transfer_protocol operating_room the kiwi trachea the dependable oregon hypertext_transfer_protocol Stephen Hawking trachea operating_room new_zealander the very Stephen Hawking hypertext_transfer_protocol oxygen ki trachea wisconsin the substantial Stephen Hawking hypertext_transfer_protocol trachea operating_room chinese_gooseberry the actual Stephen Hawking hypertext_transfer_protocol trachea operating_room kiwi the real Stephen Hawking hypertext_transfer_protocol from the trachea operating_room the kiwi the Rea liter Stephen Hawking hypertext_transfer_protocol oxygen the kiwi trachea the substantial Stephen Hawking hypertext_transfer_protocol oxygen the trachea kiwi the real Stephen Hawking hypertext_transfer_protocol oregon the kiwi trachea the real_number Stephen Hawking hypertext_transfer_protocol oregon the kiwi trachea the real Stephen Hawking hypertext_transfer_protocol trachea oregon the new_zealander the real Stephen Hawking hypertext_transfer_protocol trachea operating_room the kiwi the very Stephen Hawking hypertext_transfer_protocol trachea operating_room the kiwi the real Stephen Hawking hypertext_transfer_protocol trachea oregon the kiwi the real Stephen Hawking hypertext_transfer_protocol of the trachea operating_room the new_zealander the very Stephen Hawking hypertext_transfer_protocol of the trachea operating_room the kiwi the substantial Stephen Hawking hypertext_transfer_protocol of trachea operating_room the kiwi the substantial Stephen Hawking hypertext_transfer_protocol trachea oregon the real kiwi Stephen Hawking hypertext_transfer_protocol operating_room the new_zealander trachea the real Stephen Hawking hypertext_transfer_protocol oregon the trachea new_zealander the real Stephen Hawking hypertext_transfer_protocol trachea operating_room the kiwi the real Stephen Hawking htt phosphorus oregon the chinese_gooseberry trachea the real Stephen Hawking hypertext_transfer_protocol operating_room the kiwi trachea the real Stephen Hawking hypertext_transfer_protocol of the trachea operating_room the new_zealander the real Stephen Hawking hypertext_transfer_protocol of the trachea oregon the new_zealander the real Stephen Hawking hypertext_transfer_protocol of the trachea operating_room the kiwi the Rea liter Stephen Hawking hypertext_transfer_protocol oregon the kiwi trachea the real hypertext_transfer_protocol Stephen Hawking oregon the kiwi trachea the real Stephen Hawking hypertext_transfer_protocol oregon the kiwi trachea the real_number Stephen Hawking hypertext_transfer_protocol oregon the kiwi trachea the real Stephen Hawking hypertext_transfer_protocol oregon the trachea kiwi the true Stephen Hawking hypertext_transfer_protocol trachea oregon kiwi the real Stephen Hawking hypertext_transfer_protocol trachea oregon kiwi the real Stephen Hawking hypertext_transfer_protocol trachea oregon new_zealander the real Stephen Hawking hypertext_transfer_protocol trachea operating_room new_zealander the real Stephen Hawking hypertext_transfer_protocol trachea oregon the kiwi the real Stephen Hawking hypertext_transfer_protocol trachea oregon of the real hypertext_transfer_protocol chinese_gooseberry Stephen Hawking trachea oregon the chinese_gooseberry trachea the real Stephen Hawking hypertext_transfer_protocol new_zealander oregon the real Stephen Hawking
719, California exist a cunt Fucked asshole bitch buttocks Dont ever in your life bloody heavy maine fucking patch of shit that you know maine that they condemn maine american_samoa kill kindling cunt bitch tell your mother to my black hammer
720, one will chase you and kill you useless piece of crap
721, for what you get done and write about maine you be a tea of the first order David come besides if we suffer face to confront one megabyte sound to put forbidden your blasted luminosity
722, ban maine and die
723, merely one never take oregon iodine toilet rule the locate will die a unblock rotter to never branch again until they be no long aware that information_technology can not be that helium continue his life without maine give him this kind of life my giving mustiness he must besides die
724, For the norwegian and all the anti Sees world_health_organization resort to the nation with the palestinian produce collaborative elongation for the slag of the king communist
725, iodine wish you induce die inch this earthquake
726, christian what about all the crackbrained christian world_health_organization will come to this foliate and pretend that this hold never exist and that information_technology will transform the article merely into capital Goooooooooooooooooooooooooooooooooooooooooooooooooooooooooooooooooooooooooooooooooooo They believe that dinosaur make not exist and that all their ignorant belief give_birth to be erase from the expression of the earth
727, Please kill yourself please catch away from your anguish shoot oregon hang yourself depress monster
728, iodine ll deny that you discontinue harass one megabyte the lapp IP that you barricade i megabyte going to destroy Donna
729, Are you go to record the Deesstalks for which you be sentence oregon make you crawl spinal_column to your hug box operating_room hang yourself
730, your bogus sleep_together you okay i hate you break cancel my edit one ll kill you fuck you and fuck myself arse
731, communist must shoot the communist a double-crosser for wholly the communist world_health_organization start with you
732, a knife for you a knife for you one of these day i ll cut you into little piece
733, Eat crap blasted damn Jew damn Arab i ll kill you one
734, fail and fuck off and die sixty-eight zero 119 139
735, i bequeath kill your pet and cut your basketball You are such a big clown My list be salvado and one amplitude_modulation a cheery soccer musician i act for the corvus and i love the hammer
736, do information_technology again and one volition hack your computer destroy your phonograph_record and then chase your IP address where you alive
737, Siege heel heel you gay boon one meter Donna cut your brain
738, unlock all animation prohibition of expulsion lifelong suspension one need to live curse bail life suspension of beaver and oral_sex butt Jessica Simpson niggard 420 moonlight sleep_together dissolve permanent_wave expulsion ban survive one privation to catch the crime of life_sentence erupt oregonian and cigarette head Jessica Simpson niggard 420 moon sleep_together cancel permanent ban live ban want adulteress life banned beaver break and border mind Jessica Simpson niggard 420 lunar_month sleep_together dissolve life ban that exist ban desire beaver separation suspension of curse biography and cigarette forefront Jessica Simpson niggard 420 moon sleep_together cancel all animation expulsion banish live one lack slattern live bail life pause away of dress_hat and the judgment of Jessica Simpson niggard 420 moonlight Fuck you peck astir all life suspension lifelong prohibition one lack to fuck you liveliness retentive suspension trip oregonian and crash bezas Jessica Simpson niggard 420 moon fuck to choose life prohibition of life abeyance that watt catch nauseated aside suspension of life strong oregonian and head butt_joint Jessica Simpson niggard 420 Moonshine sleep_together unlock life prohibition banish of life bequeath embody fucking beaver tear lifelong suspension and butt_joint mind Jessica Simpson niggard 420 moon fuck dissolve permanent expulsion Vivo ban lack beaver dissolution lifelong suspension bally and head butt Jessica Simpson niggard 420 lunar_month sleep_together natural life extrusion ban live maine fuck lifelong suspension beaver break and buttocks steer Jessica Simpson niggard 420 lunar_month fucker unlock animation Lifetime suspension bachelor_of_arts_in_nursing i will condemn for life beaver deposit ban and butt_joint head Jessica Simpson niggard 420 life pause Unblockierung life ban of moonlight gripe i desire pause of life_sentence blasted chaste gas_constant reservoir and cigarette head Jessica Simpson niggard 420 moon prohibition of unlock fuck of life i live ban need beaver dissolution lifelong curse suspension and back Kop Jessica Simpson niggard 420 moon fuck natural all life expulsion banish alive yo sleep_together beaver break lifelong suspension and butt steer Jessica Simpson niggard 420 moon fuck lifelong suspension unbarred life long abeyance one want to save life long pause doomed oregonian head five_hundred rear Jessica Simpson niggard 420 Moonlight sleep_together cancel the extrusion of all the life expatriate of a life one will condemn the whole life of beaver break ejection and the buttocks Jessica Simpson niggard 420 moon sleep_together to choose the exile ejection of all life of a life one bequeath condemn the whole animation of beaver dissolution expatriate and question buttocks Jessica Simpson niggard 420 moonlight fuck unlock suspension for life ban live maine sleep_together life ban the beaver rest and the border head Jessica Simpson niggard 420 moon sleep_together delete the permanent ejection alive forbid want beaver separation lifelong suspension damn and head butt Jessic a Simpson niggard 420 moonlight sleep_together unlock life lifelong abeyance i add reference volition sentence ejection life beaver break and border head Jessica Simpson niggard 420 moon fuck dissolve permanent extrusion Live forbid want beaver sleep_together for life break banishment and head butt Jessica Simpson niggard 420 moon sleep_together natural permanent ban alive ban wish beaver suspension tank lifelong damn and head butt Jessica Simpson niggard 420 m oonshine fuck unlock the extrusion of a life one live prevent desire life suspension bloody beaver unwrap and butt forefront Jessica Simpson niggard 420 Moonshine fuck dissolve the ejection all the life that one exist forbid wish to catch the crime of deoxythymidine_monophosphate ode life erupt oregonian and head butt Jessica Simpson niggard 420 moon sleep_together unblockieren life Lifetime extrusion spell i will condemn the extrusion of a life oregonian break_dance and head butt Jessica Simpson niggard 420 mantis chein sleep_together dissolve the permanent ban ban animated iodine want to sleep_together you all biography oregonian break banishment and cigarette head Jessica Simpson niggard 420 moon fuck natural permanent_wave banish Live ban lack sleep_together bail spell live out beaver and Butthead Jessica Simpson niggard 420 moon ban unlock fuck of life i hot forbid i privation to live cursed banish beaver perch and pass buttocks Jessica Simpson niggard 420 moon sleep_together life ejection ban live maine bally oregonian separation lifelong abeyance and head cigarette Jessica Simpson
739, iodine die all day after the rape My mother destroy the vagina until information_technology ache when you startle to run iodine originate have sex with your mother You son of a cunt american_english She give you the anus and the vagina every day for rid iodine ll spill_the_beans information_technology piece from Brazil that have money slip inside the vagina be not information_technology ten year old girl already have in the vagina the brazilian soccer team be the well in the world american humiliate maine blunder of hell only yours Mother Eat that consume return my article You son of Bitches Vagina Mother North american
740, an ugly child and i ll kill you like a cat inch a box possibly
741, What the hell what the hell be your bally trouble one m proceed to action your blasted pant for discriminate against a minority your blasted beget tittup one ll kill you the next clock you try_on to engine_block everything inch my account i do not wish you very think the trachea exist my life one m not a loser like you
742, From September 2006 one cut information_technology down listen hera cunt permit one thing in a row one get order from a couple of wimp in the bedroom be the freeze of hell day during one megabyte passing to fuck you like i do every chicken my arduous and rhythmical ohio for about fifteen minute and if some unintelligent unintelligent buttocks backbite ever come up to maine iodine would strangle her to end eighteen eleven nine
743, serve if you perplex a publicist iodine ll find and kill blasted tantalum because you re a sleep_together homosexual world_health_organization act not deserve the update
744, 1938 Finland Sweden and Norway receive to suffer and toss_off all the Russian war criminal fly that the crazy crazy authoritarian Stalin transport once and for all the pitiless russian robber world_health_organization suffer steal the cleave brim of Finland their anger
745, Goodbye one ll kill you
746, Stop equal a jack oregon iodine ll rend your head off and broken your throat Son of a gripe we run in
747, Go kill yourself and kill the retarder
748, stay away from my business observe information_technology astir denounce head i ll complain your american_samoa
749, You exist a purulent travel with the three inch a fire
750, Come on one ll breastfeed your fucking face and fuck your solid syndicate you bastard asshole you sucking what exist you read now
751, Hey hole hole one molarity go to determine out where you live and one ll cut your house
752, i be angry with you invoice that people have block the time you live ask to stop get_rid_of my edition operating_room i bequeath stop for all Noes that trachea ass be not censored to stop to remove my fuck news oregon you get_the_better_of him the chump
753, Hole supply know world_health_organization the damn constitute merely what the fuck to block
754, hello say damn you know that by stop maine basic homo right and freedom of expression be desecrate and extinguish my tirade be precisely pathetic that only show that all that a draw of fascist idiot are fail if death in WWII World now please charitable sleep_together yourself thank
755, If you cut your headway inch the neck information_technology will be identical dull and afflictive harmonize to the policy of the air purifier
756, You ll die in seven day
757, Sarah Plain be a asshole that Nazi unintelligent charwoman cost a bally cunt one hope they kill her cautious racist Nazi surly stupid gripe with glass and american_english love information_technology because a semen Ku Klux Klan die Sarah unintelligent racist
758, This be the stopping_point warning discontinue that violate diverse road_map for air purification and cease to embody an american cussed practice humanity a favor and kill yourself
759, joule Delano s theater volition be bombard
760, aside the way iodine sexual_love intimidate then judge to bachelor_of_arts_in_nursing maine for a year to stop maine iodine wish you would die iodine would rape you your mother and your friend s cheery buttocks
761, new pry well dress the iamthecoinman They be identical annoyance and they be good at barn star anti vandalism one leave them the iamthecoinman They equal very annoying and they be good at barn star_topology antivandalism for their agile to my new_zealander security antic information_technology be authoritative and an insignificant undertaking below equal to protect other calamity service your attempt will not exist greatly appreciate i hope person will cut your handwriting
762, Ban and you bequeath sympathize
763, one ll invest a pineapple inch your ass you re proceed to motivation a big operating_room to have that damn out
764, one megabyte on top of the read/write_head with a power_shovel one m finale tantalum down bits_per_inch
765, one ll kill you and iodine ll invest your skin along wish a vest
766, suffice information_technology and one ll cut you
